5/13/2013,"The Davey Tree Expert Company, Winston Salem, NC 27103                                     ","Worker killed when bucket lift malfunctioned during tree trimming, causing worker to fall 35 feet.",Fatality
5/12/2013,"Mike's Landscaping and Tree Service,  Fort Madison, IA 52627",Worker struck and killed by falling tree limb while performing tree trimming operations. ,Fatality
5/12/2013,"Robert Crowder Construction, Webster, Springs, WV 26288",Employee struck and killed by tree limb during tree cutting operations.,Fatality
5/10/2013,"Astec Inc., Chattanooga, TN  37407",Worker struck and killed when a silo head fell from crane.,Fatality
5/10/2013,"Total Metal Services LLC, Romulus, MI 48174",Worker died after a dumpster fell and crushed him.,Fatality
5/9/2013,"Eagle Adjusting Services Inc.,  Ferndale, MI 48220",Worker suffered fatal injuries after falling 18 feet from roof.,Fatality
5/9/2013,"FIC America, Bloomingdale, IL 60108",Worker died after being pinned under a steel coil.,Fatality
5/9/2013,"Lischka Construction, Richmond, TX 77406",Employee died after being caught between two tractor graters.  ,Fatality
5/9/2013,"M.J. Sheridan of Texas Inc, Austin, TX 78730",Worker died after being crushed under a ditch digger when it rolled down a steep hill.  ,Fatality
5/9/2013,"Pfizer Inc., Yucca Valley, CA  92284                                       ",Worker killed after being shot during carjacking.,Fatality
5/9/2013,"Southland Tube Inc., Birmingham, AL 35234","Worker performing warehouse operations died after being pinned between a load and bundles weighing more than 4,000 pounds.",Fatality
5/8/2013,"Hasson's Mobile Truck & Trailer Repair, East Moline, IL 61244",Worker died after semi-trailer collapsed on him during repairs.,Fatality
5/8/2013,"J & L Auto Body Parts, Elizabeth, NJ 07202",Worker killed when vehicle elevated by forklift and chain fell on him while performing repairs.,Fatality
5/8/2013,"Midwest Wrecking Company, Morrison, OK 73061",Truck driver died after vehicle was struck by train at railroad crossing.  ,Fatality
5/8/2013,"Shoreline Metal Fabricators Inc.,  Rothbury, MI  49452",Worker died after falling 30 feet through skylight during HVAC removal operations.,Fatality
5/8/2013,"Wayne Westland Fire Dept., Westland, MI  48185",Worker died when roof collapsed while fighting a fire at a mall.,Fatality
5/7/2013,"All Season?s Insulation, Danville, IN 46122",Worker spraying a building with insulation fell approximately 10 feet.,Fatality
5/7/2013,"Harvey Paving & Sealcoating, Orono, ME 04469",Foreman struck and killed by vehicle while constructing a driveway.,Fatality
5/7/2013,"Kerry's Ingredients and Flavors Union City, CA 94587",Worker died from head injuries when a cart he was pushing was struck by a forklift.,Fatality
5/7/2013,"Lindstrom Brothers Air Conditioning Inc., Coconut Creek, FL 33093",Worker died after falling from ladder while installing air conditioning ducts at construction site.,Fatality
5/7/2013,"M Boren Services, Inc., Myton, UT 84052",Worker crushed and killed when a 40-barrel tank exploded at a well site.,Fatality
5/7/2013,"Southern Mechanical Contractors, Chamblee,  GA 30341","Employee died after the scissor lift he was inside malfunctioned, pinning worker between the lift and a pipe. ",Fatality
5/6/2013,"Jet Maintenance, Runge, TX 78151",Worker died when a flare line pipe struck his head and neck while he attached piping to a well head.,Fatality
5/6/2013,"Longview Asphalt Inc., Jacksonville, TX 75766",Employee killed when struck by pneumatic gates while unplugging the discharge chute to an asphalt silo.,Fatality
5/6/2013,"SD Restoration Inc., Miami, FL 33122",Employee died after falling from 20-foot ladder while applying caulking inside a warehouse.,Fatality
5/6/2013,"T.H. Ryan Cartage Company, Kenosha, WI 53144",Driver suffered fatal injuries after truck rolled backward onto him while at a loading dock.,Fatality
5/5/2013,"Business Construction Services LLC, Fayetteville, AR 72701",Employee died in a trench collapse. ,Fatality
5/5/2013,"Schneider National Carriers Inc., Janesville, WI 53546",Tractor-trailer driver died after falling from his truck cab at a home improvement store. ,Fatality
5/4/2013,"Beaver Excavating Company, Canton, OH 44706",Two carpentry employees died when the crane boom they were using to lift a load fell on them.,Fatality
5/3/2013,"Alpine Waste & Recycling, Denver, CO 80216",Worker fatally crushed when the hydraulic compacting mechanism on rear section of trash truck activated.,Fatality
5/3/2013,"DRP Industries, Grnbury, TX 76048",Employee died of head trauma after being caught in machine tool.,Fatality
5/3/2013,"Ed and Eddys Inc., Panama City Beach, FL 32407",Employee died after being caught in and crushed by an automated bowling pin setting machine. ,Fatality
5/3/2013,"Gilt Groupe Inc., Brooklyn, NY 11205",Employee died after falling four stories to the bottom of an elevator shaft.,Fatality
5/3/2013,"Madison Logging Inc.,Caryville, TN 37714

",Worker struck and killed by a falling tree.,Fatality
5/3/2013,"Murphy Oil Corporation, Fremont, OH 43420",Employee killed when oncoming vehicle crashed into work vehicle.,Fatality
5/3/2013,"Platt Logging, Constantia, NY 13044",Employee struck and killed by tree while performing logging operations.,Fatality
5/3/2013,"Severiano Lopez, Los Angeles, CA  90068",Worker found dead during tree trimming operations.,Fatality
5/3/2013,"Weatherford Pumping Unit, Marmarth, ND 58643",Worker died from chest injuries after a belt drive from an oil well pumper unit fell on him.,Fatality
5/2/2013,"Alta Fuels, Chama, NM  87520",Worker died when tanker truck rolled over.,Fatality
5/2/2013,"Culver Metal Supply LP, Mansfield, TX 76063","Employee killed after 17,000-pound metal coils being moved by a crane fell on him.",Fatality
5/2/2013,"Formosa Plastics Corporation, Point Comfort, TX 77978",At least three employees were hospitalized for burns when a flash fire occurred at a plastic resins and petrochemical plant. ,Catastrophe
5/2/2013,"Griesbach Farm, Appleton, WI 54913",Farm worker died after being caught in auger.,Fatality
5/2/2013,"Mortenson Brothers Farms Inc., Plainfield, WI 54966",Worker died after being struck and pinned beneath the landing gear of a semi-truck backing up to loading dock.,Fatality
5/2/2013,"PMIC Inc., Point Comfort, TX 77978",At least three employees were hospitalized for burns when a flash fire occurred at a plastic resins and petrochemical plant. ,Catastrophe
5/1/2013,"Flora-Tech Plantscapes Inc., Coral Gables, FL 33134",Employee died after falling nearly 20 feet while installing plants on the inside of a newly constructed nursing facility.,Fatality
5/1/2013,"Scott Schultz Roofing and Painting, Madison, WI 53704",Worker died after falling from a residential roof.,Fatality
4/30/2013,"Albuquerque-Bernalillo County, Albuquerque, NM 87110                   ",Worker struck and killed by vehicle while securing gate at facility lift station.,Fatality
4/30/2013,"American Eagle Buildings Inc., Greneseo, IL 61254",Employee died after falling 25 feet from a beam that broke during roofing operations.   ,Fatality
4/30/2013,"ATS Welding, Inc., West Haven, UT  84401",Worker died after falling 30-feet when wind gusts caused roofing material to become airborne and hit worker.,Fatality
4/30/2013,"Fremont Forest Systems Inc., Silver Lake, OR 97638",Worker killed when a tree being cut down fell on him.,Fatality
4/30/2013,"Home Depot, Mission, TX 78572","Employee died from head injuries after a set of heavy duty screen doors he was stocking fell on him, knocking him to floor.",Fatality
4/30/2013,"Lake County, Finland, MN  55603",Worker killed when excavator slipped on icy road and fell into river.,Fatality
4/29/2013,"Brookover Ranch Feed Yard, Garden City, KS 67846","Employee crushed and killed when a metal fence he was cutting fell on him, pinning him underneath. ",Fatality
4/29/2013,"Pastore Cabinet Makers Inc., Madison, VA 22727","Worker died when a hydraulic lift fell, crushing him underneath.",Fatality
4/29/2013,"S&S Properties, Alvin, TX 77511",Employee died after being struck by a tree during tree cutting operations.,Fatality
4/29/2013,"Sherman Brothers Trucking Inc., West Crossett, AR 71635",Employee found dead at bottom of crude oil tank from apparent over-exposure while performing cleaning operations.,Fatality
4/29/2013,"Sundquist Fruit and Cold Storage Inc., Yakima, WA 98901",Worker died from injuries after falling off and being run over by a tractor.,Fatality
4/27/2013,"Dudley Hilton, Philadelphia, PA 19147",Employee electrocuted after contacting energized electrical lines and adjacent copper piping.,Fatality
4/27/2013,"Floyd Peterson, Cooksville, MD  21723",Worker died from a 17-foot fall from a roof.,Fatality
4/27/2013,"Harrison Gypsum Co., Shamrock, TX 79079","Employee died after being pulled into conveyor while removing a rock that was stuck in machine.
",Fatality
4/27/2013,"Jesus Valladares, Kendalll, FL 33183",Worker died after falling off tractor and striking head on rake of the tractor.,Fatality
4/27/2013,"Potlatch Corporation, Bemidji, MN 56601","Employee died when hand railing on catwalk gave way, causing worker to fall 40 feet. ",Fatality
4/26/2013,"Britz Wrecking, Kansas City, MO 64109",Employee killed when debris from a wall being demolished struck his head.,Fatality
4/26/2013,"DCS Sanitation Management Inc., Clackamas, OR  97015",Worker died after spray hose he used to clean meat blender got caught on rotating blade and pulled him into machine.,Fatality
4/26/2013,"Downey Trees Inc., Alpharetta, GA 30005",Employee died after being struck by tree during tree removal operations. ,Fatality
4/25/2013,"Complete Automation Inc., Smyrna, TN 37168",Worker died when large control panel he was moving tipped over on him.,Fatality
4/25/2013,"Rick's Tree Service LLC, Wilmington, DE 19803",Worker died after being struck by cable used to pull tree limbs into shredder.,Fatality
4/25/2013,"Siemens Industry, Inc., Mountain View, HI  96771",Worker electrocuted after contacting live parts inside cabinet of well pump motor.,Fatality
4/25/2013,"So Cal Edison, Menifree, CA 92586",Worker electrocuted while working in underground vault.,Fatality
4/25/2013,"William Joseph La Grasso dba Superior Painters, Big Bear City, CA 92315","Worker killed when ladder used during painting operations fell, landing on worker. ",Fatality
4/24/2013,"Giovanni Lawn & Garden, Oakton, VA 22124",Worker died from head injuries after being struck by tree he was cutting down.,Fatality
4/24/2013,"Machine Tools Inc., Grosse Tete, LA 70740",Employee died from injuries after a traffic accident with a 18-wheel truck.,Fatality
4/24/2013,"NYCTA - Signal Maintenance Division, Astoria, NY 11103",Worker killed after falling from ladder at end of train platform and tumbling in front of a train.  ,Fatality
4/24/2013,"Oil Recovery Co. Inc., Mobile, AL 36602",Three employees burned while cleaning a fuel barge that exploded.,Catastrophe
4/24/2013,"Progressive Environmental Services Inc., St. Petersburg Beach, FL 33706",Employee crushed and killed by elevator car while cleaning water out of an elevator shaft. ,Fatality
4/23/2013,"Harold G. Butzer Inc., Altus, OK 73521",Employee in a bucket lift died after being pinned between bucket and I-beam.  ,Fatality
4/23/2013,"Little by Little Trucking, Las Vegas, NV 89135",Worker killed when concrete pipe rolled off truck bed and crushed him.,Fatality
4/23/2013,"Primeflight Aviation Services Inc., SeaTac, WA 98158",Worker died when an airline baggage cart with tug struck him as cart was being pulled to exit gate.,Fatality
4/23/2013,"Ramsey Water Company Inc., Ramsey, IN 47166",Worker killed after vehicle was hit by oncoming train. ,Fatality
4/23/2013,"Stephen's Carpet Cleaning, Perryton, TX 79070",Employee was found dead from suspected carbon monoxide poisoning while steam cleaning carpet with a gas-powered steamer. ,Fatality
4/22/2013,"City of Louisiana, Louisiana, MO 63353",Employee died after lawnmower he was repairing fell on him.,Fatality
4/22/2013,"DCT Chambers Trucking Ltd., Kettle Falls, WA 99141",Worker killed after being run over by another vehicle while disconnecting a semi from a trailer.,Fatality
4/22/2013,"G&H Steel, Alexandria City, AL 35010",Employee died after being caught between boom lift and iron used during welding operations.,Fatality
4/22/2013,"Patton Ranch Management LLC, Beatty, OR 97621",Worker died after ATV flipped over embankment and landed on top of him.,Fatality
4/22/2013,"Platinum Mechanical Inc., Dexter, MI 48130",Worker killed in explosion while welding tank in waste water treatment plant.,Fatality
4/22/2013,"Sunland Construction Inc., Beaumont, TX 77713",Employee died after being caught between a rotating excavator and piping while engaging in trench/piping operations.,Fatality
4/21/2013,"CNM Construction Inc., Far Rockaway, NY 11694",Employee died after falling from a scaffold.,Fatality
4/21/2013,"Maury County Building and Maintenance Department, Columbia, TN ",Worker killed after being pinned under mower that rolled down steep embankment.,Fatality
4/21/2013,"St. Johns Precast Inc., St. Augustine  FL 32084",Employee died after being struck by a forklift.,Fatality
4/21/2013,"Watson Commercial Paint, Tyler, TX 75702",Employee died after being overcome by fumes while spray painting.,Fatality
4/20/2013,"American Painters Inc., Tampa, FL 33626",Employee died after falling 15 feet from ladder while pressure washing a house. ,Fatality
4/20/2013,"Civil Design Services Inc., Abilene, TX 79608",Employee struck and killed by vehicle while surveying roadway activity.,Fatality
4/20/2013,"Woodman's Food Market Inc., Beloit, WI 53511",Worker died from head injuries after falling 9 feet from ladder at food market warehouse. ,Fatality
4/19/2013,"Blades of Green Inc., Inverness, FL 34450",Employee struck and killed by tree limb.,Fatality
4/19/2013,"Century Packing Corporation, Las Piedras, PR  00771",Worker struck in head and killed by corrugated carton sheets. ,Fatality
4/19/2013,"Intex, Sioux Falls, SD 57104",Employee for indoor/outdoor recreation distributor died after his work vehicle was struck by a semi-truck.  ,Fatality
4/19/2013,"Saint Bernadette Catholic Parish, Lakewood, CO 80214",Employee died after tripping over book bin.,Fatality
4/19/2013,"Thermal Sun Glass, Santa Rosa, CA 95402                    ",Worker died when sheets of glass fell on him.,Fatality
4/19/2013,"United Ethanol LLC, Milton, WI 53563",Employee died after being engulfed in grain bin.,Fatality
4/18/2013,"Bennett Construction Inc, Manchester, OK 73758",Employee died after being struck by side boom track equipment during construction of natural gas pipeline.,Fatality
4/18/2013,"BTT Marine Construction Co. LLC, Lynn,  MA 01901",Worker died from possible drowning after falling in water while working on pier.,Fatality
4/18/2013,"Jerich International dba Jerich USA Inc., Carson, CA 90745",Worker struck and killed by fallen bale of shredded paper in warehouse. ,Fatality
4/18/2013,"Landscape Maintenance Services, Jackson, NJ 08527","Worker died from head injuries when landscaping equipment struck him, causing him to fall.",Fatality
4/18/2013,"Metal USA, Jeffersonville, IN 47130","Worker killed when a fiber glass cover, lifted off the ground by wind gusts, struck him.",Fatality
4/18/2013,"Ohio River Metal Services, Jeffersonville, IN 47130","Employee struck and killed by a 2,200-pound barge lid that became airborne.",Fatality
4/18/2013,"Smart Landcare Inc., Charlotte, NC  28210",Landscape worker killed after being hit in head by piece of metal anchor.,Fatality
4/18/2013,"Thorne's Excavating Company LLC  and N & S Waterproofing LLC, Hendersonville, TN  37075","Two workers killed, a third hospitalized after being struck by a 24-foot tall masonry wall that collapsed during 40 mph wind gusts.
",Fatality
4/17/2013,"APAC Texas Inc., Rockwall, TX 75087",Worker killed after being struck by vehicle while flagging traffic during roadside construction.,Fatality
4/17/2013,"Five Star Lawn and Landscape, Goodlettsville, TN 37072","Worker died after lawn tractor tipped over, pinning worker between ground and equipment. ",Fatality
4/17/2013,"Signature Industrial Services, Beaumont, TX 77704",At least three employees were hospitalized for burns after flash fire occurred while they worked on a heat exchanger.,Catastrophe
4/17/2013,"Signature Industrial Services, Beaumont, TX 77704",Worker died from injuries after a refinery fire.,Fatality
4/16/2013,"Akehurst Landscaping Services, Towson, MD  21204",Worker struck and killed by motor vehicle while performing landscaping activities.,Fatality
4/16/2013,"Anderson Arbor Pros, LLC, Pendelton, SC 29670",Worker died from 70-foot fall when falling tree hit crane bucket.,Fatality
4/16/2013,"CRH PLC, West Memphis, AR 72301",Two employees died after being struck by a vehicle that entered a construction work zone.,Fatality
4/16/2013,"Estenson Logistics, Santa Fe Springs, CA 90670",Worker died after falling from trailer being loaded with lumber. ,Fatality
4/16/2013,"Jim Pastor, Holiday, FL 34690",Employee died from heat stroke while installing an electrical box in attic.,Fatality
4/16/2013,"Keystone Diner, Oxford, PA 17350",Employee killed after a wall-mounted kitchen grill fell on her head. ,Fatality
4/16/2013,"L & A Trucking Co. Inc., Moody, AL 35004","Worker died from injuries after vehicle hit work truck, causing a fiber optic line to strike and sever worker's arm.
",Fatality
4/16/2013,"Mickeys Towing and Garage LLC, Brownsville, KY 42210",Worker crushed and killed when a roll-back wrecker he was repairing rolled off blocks.,Fatality
4/15/2013,"Brandon Lamb McIntosh DBA Brandon Lamb, Richmond, KY 40475",Worker struck and killed by falling tree.,Fatality
4/15/2013,"Childers Roofing & Sheet Metal Inc., Brunswick, GA 31525",Employee died after falling through a metal roof opening.,Fatality
4/15/2013,"Coquille Watershed Association, Coquille, OR  97423",Worker drowned after being trapped under pontoon raft that struck tree and flipped over. ,Fatality
4/15/2013,"Yellow Cab, Denver, CO 80202",Worker died after another vehicle struck his taxicab.,Fatality
4/14/2013,"Topside Contracting, Sheppard AFB, TX 76311",Employee died after falling 25 feet off roof while installing insulation.,Fatality
4/13/2013,"Emerald Construction Corp., Sunny Isles Beach, FL 33160","Employee died after falling approximately 36 ft from a sheer wall.
",Fatality
4/13/2013,"Feeney Brothers Excavation LLC, Dorchester,  MA 02121",Employee died after being struck by a falling load while unloading 40' lengths of pipe from a flatbed trailer.,Fatality
4/12/2013,"Affordable Waste, Houston, TX 77045",Employee died after being struck and pinned in between a container and skid steer. ,Fatality
4/12/2013,"Coca Cola North America, Anaheim, CA 92806",Worker died after being crushed between palletizer and another object. ,Fatality
4/12/2013,"Double Z Construction,  Hebron, OH 43025",Worker making bridge repairs was killed after being struck by a falling beam.,Fatality
4/11/2013,"Exterran Energy Solutions, Wick, WV 26149","Employee died from burn injuries after a flash fire occurred while working at a pipeline cleanout ""pigging"" operation.",Fatality
4/11/2013,"Lanzo Lining Services Inc, Tampa, FL 33605",Employee died from possible hydrogen sulfide exposure while cleaning sewage from pipe.,Fatality
4/11/2013,"Matchmakers Employment Service, Friona,  TX 79035",Temporary worker died after falling 45 feet from platform while performing maintenance on grain conveyor.  ,Fatality
4/11/2013,"Rose Hill Nursery, Berlin Twp, MI  48022",Worker crushed and killed when bucket overturned and fell on him while he performed tree maintenance.,Fatality
4/11/2013,"Union Electric, Saint Ann, MO 63074","Worker electrocuted while conducting storm-restoration work on a 7,200-volt line. ",Fatality
4/11/2013,"Utah Department of Transportation, Salt Lake City, UT  84121","Worker was checking for possible avalanche when one occurred, sweeping away worker.  ",Fatality
4/11/2013,"Utility Technologies International Corporation, Wick, WV 26149",Employee died from burns after a flash fire occurred while working on a pipeline cleanout operation.,Fatality
4/10/2013,"American Framing Inc., Santa Rosa Beach, FL 32459",Employee died after being struck by a front end loader on a construction site.,Fatality
4/10/2013,"Cathay Pacific Airways Ltd., Jamaica,  NY 11430",Employee struck and killed by cargo transporter during loading operations at airport.,Fatality
4/10/2013,"DC Cash and Carry,  Washington,  DC 20002",Employee died after falling 10 feet from a powered industrial truck while accessing a rack storage system.,Fatality
4/10/2013,"Masonry Medic LLC,  Cynthiana, KY 41031","Two workers electrocuted when the boom truck basket they were inside contacted a 7,200-volt power line while they performed chimney repair work.",Fatality
4/10/2013,"Pacific States Industries dba Redwood Empire Sawmill, Cloverdale, CA 95425",Worker died after becoming stuck in a debarker while trying to unjam the machine.,Fatality
4/10/2013,"Residential Creations LLC, Bridgeport, WV 26330",Employee died after falling 20 feet to the ground while making repairs to residential structure. ,Fatality
4/10/2013,"Spillzz LLC,  Jacksonville,  FL 32254",Worker died after a garage collapsed on him while he was removing wood planks.,Fatality
4/10/2013,"Utah Truck and Trailer Repair, LLC, Salt Lake City, UT 84119",Worker died when truck he was servicing slipped into gear and ran over him.,Fatality
4/9/2013,"Waste Landfill Recycling Services, Guanica, PR 00653",Worker struck and killed by garbage container that came loose during unloading process.,Fatality
4/8/2013,"A Street Logging, Fenwick,  WV 26202",Worker struck and killed by falling tree.,Fatality
4/8/2013,"Department of Public Works,  Indianapolis, IN 46204

",Worker died after being pinned between tree and sanitation truck and then run over by truck.,Fatality
4/8/2013,"Excel Utility Construction Inc., Mineola, TX 75773","Employee killed when a boring machine tipped over, crushing him.  ",Fatality
4/8/2013,"R. R. Donnelley and Sons Company, Lancaster,  PA 17601",Employee killed after being crushed by the rear axle of forklift. ,Fatality
4/8/2013,"S C SAPP Inc., Leopold, IN 47630",Employee died after falling from courier/delivery vehicle.,Fatality
4/7/2013,"AK Steel Corporation, Middletown, OH 45043",Worker died from burns after an explosion at a steel mill.,Fatality
4/6/2013,"Hernandez Lanscaping, San Clemente, CA 92673",Worker died from head injuries after falling six feet while trimming trees.,Fatality
4/5/2013,"Basic Energy Services, Barstow, TX 79719",Two workers died from injuries from a blown high-pressured oil well.,Fatality
4/5/2013,"Pacific Excavation, Coto de Caza, CA 92679                                           ",Worker died when a side wall collapsed on him while performing sewer/storm drain cleanup.,Fatality
4/5/2013,"R. King Window Corp., Brooklyn, NY 11222",Worker died from fall while cleaning building windows.,Fatality
4/5/2013,"Upstage Center Inc,  San Antonio, TX 78219",Worker died from a 100-foot fall while dismantling iron cross beams in a concert stage setup. ,Fatality
4/5/2013,"Wilkinson Roy Iron & Metal Inc., McAllen, TX 78501",Employee struck and killed by the front axle of a tandem axle trailer.,Fatality
4/4/2013,"Balyasny Asset Management LP, Mequon, WI 53097",Worker died after falling from second floor to lower level of residential home while disassembling a scaffold.,Fatality
4/4/2013,"Dring Air Conditioning and Heating, Fort Worth, TX 76107",Employee died after falling 20 feet from a ladder.,Fatality
4/4/2013,"Fort Worth Grain Exchange, Frederick,  OK 73542",Employee electrocuted when a probe used to take grain samples contacted an overhead power distribution line.,Fatality
4/4/2013,"Vesuvius USA Corporation, Chicago Heights, IL 60411",Employee died after making contact with moving auger blades while cleaning a refractory mixer.,Fatality
4/3/2013,"BAE Systems Southeast Shipyard, Mobile,  AL 36652","Employee has not been found and is presumed dead after cruise ship he was painting broke loose during heavy weather causing vessel to strike pier, throwing him into water.",Fatality
4/3/2013,"New England Motor Freight Inc., Batavia, OH 45103",Employee died after being crushed between truck bed edge and a load of construction materials.,Fatality
4/3/2013,"Paladin Attachments, Ooltewah, TN 37363",Worker died when steel sheeting fell from a crane and crushed him.,Fatality
4/3/2013,"Samuelson Funeral Services In., Mankato, MN 56001",Worker died after falling down steps while transporting materials.,Fatality
4/3/2013,"Ward Trucking LLC, Grove City, PA 16127",Worker died after being caught between a semi truck and loading dock.,Fatality
4/2/2013,"3rd and Ash LLC, Dallas, TX 75226",Employee died after falling 25 feet through roof skylight.,Fatality
4/2/2013,"Carol Tires, Henderson, TX 75652",Employee killed after being struck by vehicle when he stepped out of his truck on the side of the highway. ,Fatality
4/2/2013,"Left Coast Cellars LLC, Rickreall, OR 97371",Worker died from head injuries after falling from a tractor.,Fatality
4/2/2013,"Worknet Staffing, Leesville, LA 71446","Employee died while riding as a passenger in a delivery vehicle that collided with an 18-wheel truck.

",Fatality
4/1/2013,"Emerald Construction Corp., Sunny Isles Beach,  FL 33160","Employee died after falling 30 feet to the ground while securing 2x4s to a wall.
",Fatality
4/1/2013,"Hedge & Herberg Inc.,  Ortonville, MN 56278",Worker died from burns after the semi-trailer he was working on caught fire.  ,Fatality
