7/5/2013,"Etchegaray Farms LLC, Richgrove, CA 93215",Worker died from possible heat illness while working at farm.,Fatality
7/5/2013,"Keystone Automotive Industries Inc., Lakewood, NJ 08701",Employee died after falling from a lift in an automotive distribution facility.,Fatality
7/5/2013,"Metra, Chicago, IL 60601",Worker struck and killed by train while performing track maintenance.,Fatality
7/5/2013,"Riverside County FD- Station #35, Thousand Palms, CA 92276                                 ",Emergency rescue worker struck and killed by vehicle while responding to an emergency call on highway ramp.,Fatality
7/5/2013,"Stickfort Construction Corporation, Waterloo, IA 50701",Worker killed after being buried in trench cave-in.  ,Fatality
7/4/2013,"F/V Aleut Sisters, Chignik, AK 99548",Employee died after entering engine space and falling onto rotating propellar shaft of the vessel.  ,Fatality
7/4/2013,"F/V Anna Lane, Homer, AK 99603",Worker killed when he was pulled into an anchor winch after becoming entangled in an anchor wire rope.,Fatality
7/4/2013,"F/V Pauline II, Egeik, AK 99579",Employee died after being trapped in a fire on a marine vessel.,Fatality
7/3/2013,"Badlands Power Fuels LLC, Watford City, ND 58854",Employee died from possible exposure to chemicals while cleaning the inside of a tank.,Fatality
7/3/2013,"Brennan Marine Inc., LA Crosse, WI 54603",Worker dies in tugboat that crashed over the roller gates of a river lock.,Fatality
7/3/2013,"Camp Tawonga United Jewish Community, Groveland, CA 95321","Worker killed when top of oak tree snapped and fell, striking worker's head.",Fatality
7/3/2013,"Haliburton Energy Services, Jacksonburg, WV 26377",Truck driver killed after being pinned between a bulldozer and work truck.,Fatality
7/3/2013,"Midwest Mole Inc., Ordway, CO 81063",Worker struck and killed by a U-shaped metal fastener connected to a pipe line.,Fatality
7/2/2013,"Autoliv ASP, Auroua, CO 80014",Worker electrocuted after making contact with live wire while repairing electrical breaker box.,Fatality
7/2/2013,"Foothill Packing, Five Points, CA 93624                                                                                  ",Worker died from seizure after suffering apparent heat illness while performing farming activities.,Fatality
7/2/2013,"Producers Rice Mill Inc., Stuttgart, AR 72160",Employee died from apparent fall from man lift.,Fatality
7/1/2013,"Easton Coach Company, Allentown, PA 18103",Employee died from head injuries after falling to the ground from the back of bus/van while loading passenger confined to a wheelchair.,Fatality
7/1/2013,"U-Haul Moving & Storage, Fort Smith, AR 72901",Worker died in vehicular accident while moving a cargo truck inside the lot.,Fatality
7/1/2013,"Wing Stop, Oak, CA 94608",Two workers shot and killed at retail store in an apparent robbery.,Fatality
6/29/2013,"Cirque Du Soleil, Las Vegas, NV  89119",Worker died from 94-foot fall when the wire rope broke during a performance.,Fatality
6/28/2013,"Cooper Construction, Yuba City, CA 95993",Worker died from apparent heat stress after suffering a seizure while performing ground preparation.,Fatality
6/28/2013,"Jose Mendoza Gardening, Trabuco Canyon, CA",Worker drowned after falling into swimming pool while performing landscaping services.,Fatality
6/27/2013,"Border State Electric,  Clayton, NM 88415",Worker killed after being involved in a motor vehicle accident.,Fatality
6/26/2013,"Lupe's Tree Service and Landscaping, San Jose, CA  95121",Worker electrocuted when his climbing rope fell onto energized power line.,Fatality
6/25/2013,"John Deere Company, Waterloo, IA 50701",Worker died from head injuries after being struck by powered industrial truck.,Fatality
6/25/2013,"Kevin Miller, Monticello, KY 42633",Worker died after falling from bucket truck while cutting tree.,Fatality
6/24/2013,"Cantril Feed and Grain, Cantril, IA 52542",Worker died after being struck by section of pipe while exiting boom lift that rolled over.,Fatality
6/24/2013,"Chelan View Orchards Inc., Manson, WA 98831","Worker killed when the orchard tractor fell over six-foot enbankment, rolled down hill and caught fire.",Fatality
6/24/2013,"Co-Alliance, Union Mills, IN 46382",Worker killed when an explosion at grain elevator occurred causing worker to fall 100 feet.,Fatality
6/24/2013,"Greathouse Landscape Company Inc., LaVergne, TN 37086","Worker killed when lawnmower overturned, crushing him.",Fatality
6/24/2013,"Krieger Collison Center, Muscatine, IA  52761",Worker died from severe trauma suffered during a tornado.  ,Fatality
6/24/2013,"Municipio de Vieques Sancamiento y Salud, Vieques, PR  00765",Worker struck and killed by a concrete beam that fell when a truck crashed into it.,Fatality
6/24/2013,"NYCDOPR, Staten Island, NY 10305",Worker collapsed and died while pruning hedges. Cause of death under investigation.,Fatality
6/24/2013,"Sam's Gardening, Upland, CA  91789",Worker drowned after falling into pool while blowing leaves in backyard.,Fatality
6/22/2013,"Blue Ridge Cable, Mouthcard, KY 41548",Worker performing landscaping along highway was struck and killed by a motor vehicle.,Fatality
6/22/2013,"Duarte Nursery, Hughson, CA 95326",Worker fainted and later died after complaining of chest pains while performing outside bench irrigation work.,Fatality
6/20/2013,"RNDS, Indianapolis, IN 46241",Worker died after falling 15-feet through skylight during roofing repairs.,Fatality
6/19/2013,"Newtown Farm Services, Veedersburg, IN 47987",Worker died after being pulled into grain flow while clearing blockage in grain bin. ,Fatality
6/19/2013,"Recycling Inc. Des Moines, IA 50309",Worker fatally crushed between a garbage truck and parked trailer while directing tow truck.,Fatality
6/18/2013,"E Light Electric Services Inc., Desert Center, CA 92239",Worker died of apparent heat-related illness.,Fatality
6/18/2013,"Optima Contratista General, Ponce, PR 00716",Worker killed when side walls inside an excavation collapsed.,Fatality
6/18/2013,"Youngstown Fire Department, Cambria, NY  14132  ",Worker killed in a vehicle collision.,Fatality
6/17/2013,"Townsend Tree Service, Lawrenceburg, KY 40342",Worker suffered fatal fall while cutting tree limbs.,Fatality
6/16/2013,"Nissan North America Inc., Smyrna, TN  37167",Worker struck and killed by articulating robot while replacing robot gears.,Fatality
6/15/2013,"Dick Oykstra Dairy, Ontario, CA 91761",Worker crushed and killed by gate while moving cows.,Fatality
6/15/2013,"Xcel Energy, Artesia, NM 88210",Worker electrocuted when power line he was repairing contacted another live power line.,Fatality
6/14/2013,"David Dougherty Trucking, Rio Linda, CA 95673",Worker fatally crushed when delivery truck he was repairing fell on him.,Fatality
6/14/2013,"Western Waste Management, St. Carson, CA 90745",Worker died after being caught between a forklift and waste cargo trailer. ,Fatality
6/13/2013,"Midwest Roofing Company Inc.,   Pico Rivera, CA 90660",Worker died after falling 17 feet from roof.,Fatality
6/13/2013,"Schindler Elevator Corporation, Sterling, VA 20166",Worker killed when caught between the elevator cab and an I-beam while making repairs in elevator shaft.,Fatality
6/13/2013,"Stevens Creek Quarry Inc., Cupertino, CA  95014","Worker killed when brakes on tractor failed, causing vehicle to roll hit and hit embankment.",Fatality
6/13/2013,"Xylem Tree Experts, Hurley, VA 24620",Worker struck and killed by a tree limb.,Fatality
6/12/2013,"B&H Tractor and Truck, Jackson, MI 49201",Worker died from severe burns after trailer struck a gas line causing an explosion and fire.,Fatality
6/12/2013,"Rock Hill Farm, Bluemont, VA  20135",Worker struck in the head and killed when horse he was loading into trailer kicked him.,Fatality
6/11/2013,"Harwood Engineering Inc., Albuquerque, NM 87107","Worker crushed and killed when 12,000-pound boom fell on him while changing the boom crane cylinders.",Fatality
6/11/2013,"Outlaw Construction Co., Las Cruces, NM 88012",Worker killed after being struck in chest by a reciprocating saw.,Fatality
6/11/2013,"Road Safety LLC, Fulton, MD 20759",Worker struck and killed by vehicle while setting cones for road work.,Fatality
6/11/2013,"Schinler Elevator, Santa Clara, CA  95054",Worker killed when struck by elevator counterweight while making repairs.,Fatality
6/9/2013,"Peacock Lounge, Sunnyvale, CA  94087",Worker shot and killed at worksite parking lot. ,Fatality
6/9/2013,"Securitas Security Services USA, Las Vegas, NV 89106",Worker on security patrol was shot and killed. ,Fatality
6/8/2013,"Cargill Salt, Breaux Bridge, LA 70517",Employee died from an apparent electrocution while connecting a bin indicator for a chipping unit.,Fatality
6/7/2013,"Equipment Depot Ohio Inc., Sidney, OH 45365","A forklift technician died after slipping and falling backwards, striking head on a guardrail.",Fatality
6/7/2013,"Village Mart Inc, Denmark, WI 54208",Employee working under a sport utility vehicle died from crush injuries when the scissor jack lifting the vehicle failed. ,Fatality
6/6/2013,"Air Evac Lifeteam DBA Air Evac EMS Inc., Manchester, KY 40962",Three emergency air evacuation workers killed when helicopter crashed.,Fatality
6/6/2013,"Charles Book, MILES  TX 76861",Employee drowned after the catloader he was operating fell off of a 30-foot cliff into the river.,Fatality
6/6/2013,"Diamond Surface Inc., Manvel, ND 58256",Worker found dead underneath a concrete grinder on a road construction project.,Fatality
6/6/2013,"Jake Marshall Service Inc., Chattanooga, TN  37412",Worker suffered fatal fall while performing mechanical air system service on roof.,Fatality
6/6/2013,"Reclaim Company LLC, Fairmont, WV 26555","Driver killed after trying to stop truck when its brakes released, causing truck to roll backward and strike him.   ",Fatality
6/6/2013,"Ugstad Plumbing, Inc. Fergus Falls, MN  56537","Worker killed when company van he was repairing rolled off the ramps, crushing him underneath.",Fatality
6/5/2013,"Aligned Building Systems LLC, Summerville, GA 30747",Employee killed after falling 30 feet to lower level during demolition activities.  ,Fatality
6/5/2013,"Georg Fischer Central Plastics LLC, Dallas, TX 75236",Two employees were fatally crushed by polyurethane pipes while loading a flatbed trailer. ,Fatality
6/5/2013,"Heartland Drilling, Big Spring, TX 79721",Employee died from apparent heat stress while changing out tong heads during drilling operations. ,Fatality
6/5/2013,"Industrial Roofing and Construction, West Monroe, LA 71292",Employee died from fall and crushing injuries after the concrete channels collapsed beneath him while removing roof deck.,Fatality
6/5/2013,"O&V Transport, LLC, Portland, OR  97230","Worker killed when the truck he was repairing lurched forward, crushing him under the wheel.",Fatality
6/5/2013,"Oregon State Bridge Construction, Inc., La Grande, OR  97850",Worker died from 23-foot fall off wooden walkway being built on bridge.,Fatality
6/5/2013,"The Salvation Army, Philadelphia, PA 19103",Two employees died when an adjacent 4-story structure under demolition collapsed onto the roof of the store they were working causing it to collapse. ,Fatality
6/4/2013,"First Ward Community Service, Saginaw, MI  48601",Employee killed after work vehicle was struck by another vehicle.  ,Fatality
6/4/2013,"G&G Enterprises LLC, Westport, CT 06880",Worker died from head injuries after falling 20 feet from a roof. ,Fatality
6/4/2013,"Infrastructure Corporation of America,  Radford, VA  24141",Worker killed when tractor-trailer struck him while he removed debris along highway.,Fatality
6/4/2013,"Lady Bug Natural Brand, Dripping Springs, TX 78620","Worker killed when auger he was inside fell to ground, causing machine's side rails to strike worker's neck.",Fatality
6/4/2013,"Sary Painting Inc., Harrisonburg, VA 22801",Worker died after falling nearly 10 feet from ladder while painting townhomes.,Fatality
6/4/2013,"Suntree Environment Services Inc., Orlando,  FL 32816",Employee died after being pulled against a tree trunk during felling operations.,Fatality
6/4/2013,"Tommy Burton, Staten Island, NY 10307",Employee found dead under tongue of trailer.,Fatality
6/4/2013,"Vaughan Foods, Moore, OK 73160",Employee died from head trauma after falling on exterior stairs.,Fatality
6/3/2013,"B&M Tear Off, Antioch, CA  94509",Worker died from 24-foot fall from roof while making repairs.,Fatality
6/3/2013,"Tom's Plumbing & Heating, LLC, Spirit Lake, IA  51360",Worker struck and killed by a skid loader bucket when the loader tipped forward.,Fatality
6/3/2013,"Wilbanks Trucking, Inc., Carlsbad, NM 88220",Worker died after falling 25 feet from a rig structure while trying to hook a chain to a ball hook.,Fatality
6/3/2013,"Wilkins Lumber Company Inc., Milford, NH 03055",Employee died after being crushed by the arms of an unblocked front-end loader.,Fatality
6/2/2013,"MDV - Nash Finch Company, Norfolk, VA  23502
",Worker killed when crushed between the bottom section of a tractor trailer and the dock. ,Fatality
6/1/2013,"K. Wilson and Company Inc.,  South San Francisco, CA  94080",Worker killed after falling from a forklift being used to paint a wall. ,Fatality
6/1/2013,"Kraemer-Shows Oilfield Services LLC, Cotulla, TX 78014",Employee died from electrical shock while engaged in repairs to electrical system.,Fatality
6/1/2013,"Pepsi Beverages, Chicago, IL 60609",Employee died after falling from a ladder while completing a service installation.,Fatality
5/31/2013,"Fisher Ranch Corporation, Blythe, CA 92225",Worker found dead in crop field after checking on irrigation pipes.,Fatality
5/31/2013,"Future Air Inc., St. Louis,  MO 63123",Worker died after falling from a scaffold while installing tubes for a new HVAC system. ,Fatality
5/31/2013,"Lalo's Auto Service Center Inc., Bronx, NY 10452","Employee died after the car lift gave way, causing car to fall onto him during repair operations.",Fatality
5/31/2013,"Washington State Patrol, Conway, WA 98238",Patrol officer struck and killed by truck.,Fatality
5/30/2013,"Edwin Brady Construction Company Inc., PAX  WV 25904",Employee killed after being struck by a clogged and pressurized hose during concrete preparation.,Fatality
5/30/2013,"FreshKO Produce Services, Fresno, CA  93725",Worker electrocuted after coming into contact with a live power conductor inside a charging unit.,Fatality
5/30/2013,"Ocean Twp. Public Works, Oakhurst, NJ  07755",Worker loading a garbage truck was struck and killed by another vehicle.,Fatality
5/30/2013,"Rialto Concrete Products Inc., Rialto, CA 92377",Worker was crushed by forklift.,Fatality
5/29/2013,"Agriculture Bag Manufacturing USA Inc., Oakland, CA  94603",Worker died after being caught between two spinners. ,Fatality
5/29/2013,"Dunn Roadbuilders, Laurel, MS 39440","Worker killed when a weigh pod from a silo fell on him, knocking him against a steel beam.",Fatality
5/29/2013,"Elliott Construction LLC, College Station, TX 77845","Employee died after being pinned underneath 1,500-pound shoring panels during an excavation.",Fatality
5/29/2013,"Holiday Rock, Chino Hills, CA 91708",Employee killed when work vehicle's tire blew causing worker to hit guard rail. ,Fatality
5/29/2013,"K & D Transportation Inc., Adell, WI 53001",Driver died after being pinned between a conveyor belt and the bottom of a semi-truck. ,Fatality
5/29/2013,"Nationwide Children's Hospital, Columbus, OH 43205",Employee died after being hit by the hospital shuttle bus while walking on hospital's private road.,Fatality
5/29/2013,"Olinde's Hardware Supply Company Inc., Lafayette, LA 70506",Warehouse worker died after falling while operating a forklift picker.,Fatality
5/29/2013,"Tri-State Floor Covering Supplies Inc., Cincinnati, OH 45241",Employee died after being pinned under the front tire of a powered industrial vehicle. ,Fatality
5/29/2013,"US Army Reserve, 88th Regional Support Command, Fort McCoy, WI 54656","Worker died from head injuries after vehicle he was repairing dropped, pinning him between cab and front bumper.",Fatality
5/28/2013,"A&A Express LLC, Jackson, TN 38366",Worker killed after being pinned between rear of truck and landing gear of trailer.,Fatality
5/28/2013,"Byrd Telcom, Inc., Georgetown, MS 39078",Two employees died after the gin-pole derrick they were using broke and fell away from a cell phone tower.,Fatality
5/28/2013,"C. R. England, Inc., Providence, RI 02908",Worker killed after being crushed between a truck and loading dock during backing operations.,Fatality
5/28/2013,"Coastal Plating, Corpus Christi, TX 78408",Worker died after being crushed by a large cylinder during sand blasting operations.,Fatality
5/28/2013,"Home Decorators Collection Warehouse, Mexico, MO 65265",Warehouse worker died after being crushed by a dockplate during repair and cleaning operations. ,Fatality
5/28/2013,"NYS MTA Metro-North West Haven CT Station, West Haven, CT  06516",Worker struck and killed by a train.,Fatality
5/27/2013,"AKM Machinery, Wind Gap, PA 18091",Worker died after being struck in head by piston that became unhooked from chain.,Fatality
5/27/2013,"Bonnie Plants Inc.,  Homeworth, OH 44634",Two workers died after company truck collided with semi-truck during transit.,Fatality
5/27/2013,"Cory Miller, Salado, TX 76571",Worker died after being struck by a rig and elevator after an anchor failed during water well drilling operations.,Fatality
5/27/2013,"Paramount Builders Inc., Atu'u, American Samoa 96799",Employee died after falling from rafters duing painting operations.,Fatality
5/25/2013,"Bardstown Police Department, Bloomfield, KY 40008",Police officer shot and killed by unknown assailants when he got out of car to remove road debris.,Fatality
5/25/2013,"Drilling Solutions, Lignite, ND 58752",A temporary employee died after being run over and crushed by a loader. ,Fatality
5/25/2013,"Securitas Security Services, Inc., San Bernadino, CA 92411",Worker crushed by a sliding gate that came off track.  ,Fatality
5/24/2013,"Alfons Dziezuta, Chicago, IL 60630",Employee died after falling from scaffolding that collapsed while performing tuckpointing at a residential building.,Fatality
5/24/2013,"L & H Boat Docking Service, Garfield, AR 72732",Employee working on barge died from burns and blunt force trauma after barge exploded during welding operations.  ,Fatality
5/24/2013,"Lowe's Home Centers Inc, #1130, New Castle, PA 16101",Employee died after being crushed between a box truck and trailer.,Fatality
5/24/2013,"Plasto-Tech Corporation, Elyria, OH 44035",Worker fatally crushed inside a thermo-forming press machine.,Fatality
5/24/2013,"Progress Rail Services, San Bernadino, CA 92411",Worker struck and killed by train while installing a train derail device.,Fatality
5/23/2013,"ArcelorMittal, Coatesville, PA 19320",Three employees hospitalized after being burned by hot slag from a furnace. ,Catastrophe
5/23/2013,"Battle Energy Services, Maljamar, NM  88264",Worker electrocuted when pole truck hit an overhead power line.,Fatality
5/23/2013,"Mountain Peak Vinyl, Salt Lake City, UT  84104","Worker crushed and killed when 2,000-pound container fell on him.",Fatality
5/23/2013,"S. L. Construction L.L.C., Harrisonville, MO 64701",Worker fatally crushed when two 2x8 vertical beams fell on him.,Fatality
5/23/2013,"Shoreline Foundation, Inc., Riviera Beach, FL 33404",Worker died from oxygen deficient atmosphere in a confined space. ,Fatality
5/23/2013,"Smith, Rolfes & Skvdahl Company LPA, Lancaster, OH 43130",Employee died after falling through roof while inspecting for wind damage.,Fatality
5/23/2013,"Whiting-Turner Contracting Company Inc., Bethesda, MD  20817","Worker crushed by scaffolding during relocation of a 44,000-pound section of concrete.",Fatality
5/22/2013,"Blick's Phosphate Conversions LLC, Pocatello, ID 83204",Worker died from burn injuries after the release of ammonia.,Fatality
5/22/2013,"Dependable Vending, Pomona, CA 91766",Worker killed when industrial truck collided with another vehicle. ,Fatality
5/22/2013,"Electronic Waveform Lab, Inc., Livermore, CA 94550                                    ",Worker killed when section of pipe flew up from the road striking vehicle windshield.,Fatality
5/22/2013,"Mills Ranch/Jam Trucking LLC, Livermore, CA 94551",Worker fatally crushed by large panel of concrete that fell from forklift.,Fatality
5/22/2013,"Penn Line Corporation, Bear Creek, PA 18602",Employee died after being hit by a vehicle while he was setting up a roadway workzone. ,Fatality
5/22/2013,"Star Construction LLC, Birmingham, AL 35222",Employee electrocuted when the pole on digger derrick truck contacted an electrical line.,Fatality
5/22/2013,"Tri-Modal Distribution Services, Pomona, CA  91766","Worker, standing outside of vehicle, was struck and killed when his vehicle was rear-ended causing it to hit him.",Fatality
5/21/2013,"Bapaz Ash Llc, Brooklyn, NY 11218",Employee died after falling from the third floor level while sheathing exterior of home.,Fatality
5/21/2013,"H & H Fisher?s Logging LLC,                            Hightown, VA 24444",Worker killed after being struck by tree.,Fatality
5/21/2013,"James Daryl Seibel, Bath, PA 18014",Employee died after falling 22 feet from roof while installing timbers for a barn under construction.,Fatality
5/21/2013,"Keystone Oil Products Corporation, Dillsburg,  PA 17019",Employee died after being run over by a vehicle while delivering home heating oil. ,Fatality
5/21/2013,"NPL Construction Company, Lakeway, TX 78738",Employee fatally crushed when equipment slid down incline and rolled over him.,Fatality
5/21/2013,"White Cedar, Superior, WI 54880",Employee fatally injured after being caught between a power roller and conveyor belt.,Fatality
5/20/2013,"Buena Vista Services, LLC, Sequin, WA  98382",Worker died when his vehicle was unable to stop or avoid the vehicle in front that made a sudden turn.,Fatality
5/20/2013,"Dale Gilbertson, Grapevine, TX 76051",Employee died after falling 20 feet while engaged in framing activities at new residential home.  ,Fatality
5/20/2013,"Jim Schlesser Inc., Cougar, WA",Worker struck and killed by falling tree.,Fatality
5/20/2013,"Spartan Contracting LLC,  Owensboro, KY 42301",Worker electrocuted while painting a bridge.,Fatality
5/17/2013,"Dennis Keith Greene (dba D & G Wood), Zionville, NC 28698",Worker in logging crew struck and killed by a falling limb.  ,Fatality
5/17/2013,"Greenville Recycling II LLC, Greenville, KY  42345",Worker struck and killed by lid when a 55-gallon drum exploded.,Fatality
5/17/2013,"H&G Underground Utilities, LLC, Merrillville, IN 46410",Worker electrocuted while installing a new water main.,Fatality
5/17/2013,"King Pallet Inc.,  Balltimore, MD 21221",Worker crushed and killed by forklift truck and box truck.,Fatality
5/17/2013,"Recommunity Recycling, Camden, NJ 08104",Worker crushed and killed when a wall collapsed on him.,Fatality
5/17/2013,"River City Petroleum Inc. dba Nevada Truck and Trailer Repair, Las Vegas, NV 89115                  ",Worker died when an empty tanker truck he was welding exploded.,Fatality
5/17/2013,"Trapac Inc.,  Oakland, CA 94607",Worker presumed dead after his vehicle was struck by utility tractor and pushed in the bay. Worker's body has not been found.,Fatality
5/17/2013,"Vonderhaar's Meat Market, Fort Recovery, OH 45846",Employee died from asphyxiation when his apron became entangled in a rotating wire brush while cleaning meat grinding machine.,Fatality
5/17/2013,"Wemrock Orchards, Manalapan, NJ 07726",Worker died after tractor rolled over him while trying to pull a tree from the ground.,Fatality
5/16/2013,"ATMI Precast Inc., Aurora, IL 60506",Worker died after being struck by a 500-pound piece of angle iron.,Fatality
5/16/2013,"Chicago Steel Construction LLC, Evanston, IL 60208",Employee was struck and killed by construction materials that fell from six stories above.  ,Fatality
5/16/2013,"Magnetech Industrial Services Inc., Saraland, AL 36571",Employee electrocuted while performing repairs on power system equipment.,Fatality
5/16/2013,"Mega Construction Co. Inc., Daphne, AL 36526",Employee died from head injuries after falling from a structure while installing trusses.,Fatality
5/16/2013,"Wilderness Inc. dba Ely Campgrounds Concessional, Ely, MN  55731",Worker struck and killed by tree during maintenance services.,Fatality
5/15/2013,"Independent Roofers and General Contractor Corp., Hato Rey, PR 00918",Worker died from 20-foot fall from roof while performing waterproofing services. ,Fatality
5/15/2013,"R. C. Construction Co. Inc., Columbus,  MS 39705",Employee died after being crushed between auger and frame of a concrete paver.,Fatality
5/15/2013,"St. Louis Cold Drawn, St. Louis, MO 63137",Machine operator died from electrocution after contacting live electricity in an electrical cabinet. ,Fatality
5/14/2013,"Fairview Mills Inc., Hiawatha, KS 66434",Employee died after falling into food processing equipment while attempting to clear a jam.  ,Fatality
5/14/2013,"Garay Construction Inc., Commerce City,, CO 80022",Construction worker died after falling nearly 30 feet to concrete floor.,Fatality
5/14/2013,"MAC Truck Leasing Inc., Dallas, TX 75217",Worker died after being injured while lifting a truck break drum.,Fatality
5/14/2013,"Riverbell Inc, Vero Beach, FL 32960",Worker died after falling from a 10-foot ladder while picking oranges.,Fatality
5/13/2013,"Coastal Masonry Inc., Miami, FL 33131","Worker died after falling from 7th floor while straightening rebar inside concrete wall opening.
",Fatality
5/13/2013,"Integrity Rebar Placers,  Murrieta, CA 92562","Worker killed when forklift tipped over, crushing him.",Fatality
