Date of Incident,"Company, City, State, ZIP",Preliminary Description of Incident,Fatality or Catastrophe
9/30/2013,"CAM Contractors Inc., Huntington Beach, CA 92649",Worker was electrocuted in concrete electrical vault.,Fatality
9/30/2013,"Cramer & Associates Inc., Cedar Rapids, IA 52404",Worker performing repairs on bridge killed when man lift basket pinned him against the bridge.,Fatality
9/30/2013,"Cross Creek Farms Inc., Shakopee, MN 55379",Worker was struck and killed by a horse being groomed. ,Fatality
9/30/2013,"Maher Terminals Inc., Elizabeth, NJ 07201",Worker struck and killed by truck.,Fatality
9/30/2013,"Reliable Tape Products, Vernon, CA 90058",Worker cleaning sump hole fell in and drowned.,Fatality
9/30/2013,"Skanska, Holbrook, AZ 86025",Worker died after fall from the deck of a bridge under construction.,Fatality
9/30/2013,"Super 8 Motel, Marion, IN 46952",Hotel worker fatally shot during robbery.,Fatality
9/30/2013,"Valley Logistics, Wilmington, DE 19810",Worker crushed by computer cabinet that fell from a delivery truck.,Fatality
9/29/2013,"Mega Construction Co Inc., Daphne, AL 36526",Worker died after a fall on construction site. ,Fatality
9/27/2013,"Affordable Homes Super Center Inc, Lafe, AR 72436",Worker struck and killed by an outrigger while lowering a manufactured home onto blocks.,Fatality
9/27/2013,"Bill Moen, Sole Proprietor, Tampa, FL 33664",Worker trimming a tree on a step ladder died after being struck by a tree limb and falling to the ground.,Fatality
9/27/2013,"B-Mack Wireless Inc., Indianapolis, IN 46219",Worker was crushed by a boom on crane being used to lift generator. ,Fatality
9/27/2013,"Bureau of Land Management, National Interagency Fire Center, Great Basin Smoke Jumpers, Glenns Ferry, ID 83623",Smokejumper died when his parachute canopy failed to deploy.,Fatality
9/27/2013,"Home Furniture Company, Lafayette, LA 70507",Worker died when the dock underneath the tow tractor he was operating suddenly collapsed.,Fatality
9/27/2013,"Klosterman Baking Company, College Corner, OH 45003",Worker died after being pinned between a truck and a dumpster when the truck rolled.,Fatality
9/27/2013,"Loram Maintenance of Way Inc., College Park, GA 30337",Worker crushed and killed by a light rail grinder train car.,Fatality
9/27/2013,"Robert Morey, Austin, TX 78732",Worker died after falling from the 2nd story framing level.,Fatality
9/26/2013,"ADS Logistic Services ? Gaffney LLC, Gaffney, SC 29340",Worker died after falling from a cherry picker that was struck by a truck.,Fatality
9/26/2013,"Iowa Erosion Control Inc., Liberty Center, IA 50166",Worker performing construction road flagger duties was struck and killed by a truck.  ,Fatality
9/26/2013,"Robertson Contractors Inc, Poplar Bluff, MO 63901",Equipment operator drowned when an excavator tipped and the cab became submerged in water.,Fatality
9/26/2013,"Tehama County at Long Ranch, Tehama, CA 96090",Worker died when caught between the hitch and trailer of a dump truck. ,Fatality
9/26/2013,"Terry Rimiller, Chicago, IL 60621",Worker died after falling from roof. ,Fatality
9/25/2013,"111 East Reistville RoadLantz Family Farm, Myerstown, PA 17067",Worker loading a mechanical harvester died when his leg got caught on a corn bale and pulled into the machine.,Fatality
9/25/2013,"Case Street Redi-Mix Inc., Hancock, VT 05748",Cement truck worker killed in vehicle crash.,Fatality
9/25/2013,"Evergreen Acres Dairy, Paynesville, MN 56362",Worker was struck and killed by a pay loader.,Fatality
9/25/2013,"M Daniel's Trucking LLC, Golden, CO 80402",Worker struck and killed by a dump truck. ,Fatality
9/25/2013,"Metal Systems F&E LLC, Wilder, KY 41071",Worker died after falling 25 feet while installing steel and insulation on deck.,Fatality
9/25/2013,"Ricker Oil Company Inc. (DBA Ricker Gas Station), Indianapolis, IN 46254",Worker shot during a store robbery. ,Fatality
9/25/2013,"Terry""s Construction, Blackwell, OK 74631",Worker died after falling 33 feet from aerial lift. ,Fatality
9/25/2013,"Weiser Security Services Inc., Rancho Cucamonga, CA 91730",Worker was run over by truck. ,Fatality
9/24/2013,"Berry Brothers General Contractors, Falls City, TX 78113",Five workers were hospitalized after being scalded by heated water released from a failed pressure valve on the machine they were cleaning.,Catastrophe
9/24/2013,"First Electrical Service, Honda Center, Anaheim, CA 92806",Worker electrocuted.,Fatality
9/24/2013,"Forney Industries Inc., Fort Collins, CO 80521",Worker struck and killed by a passing automobile.,Fatality
9/23/2013,"Anderson Produce Company Inc., Roseville, MN 55113",Worker died after falling in a storage room and hitting his head on the concrete floor.,Fatality
9/23/2013,"Austin & Bednash Construction Inc., Middletown, DE 19709",Worker died when the walls of the trench he was working in collapsed.,Fatality
9/23/2013,"D & K ROOFING LLC, Waynesville, MO 65583",Roofer died after falling 16 feet when part of the roof broke away. ,Fatality
9/23/2013,"G.W. Drywall, San Antonio, TX 78231",Worker died after falling 19 feet from platform.,Fatality
9/23/2013,"LP Trucking LLC, Los Angeles, CA 90069",Worker was struck and killed by window that tipped off back of truck.,Fatality
9/23/2013,"Megadyne Services Co., Barstow, TX 79719",Worker on an oil well was struck and killed when part of the drill's overhead piston pump fell on him.,Fatality
9/23/2013,"Oyster Bay Town Highway Department, Oyster Bay, NY  11771",Worker was struck by a motor vehicle during a roadside pickup.,Fatality
9/23/2013,"Southern Gas and Supply, Theodore, AL 36582",Worker struck and killed by a high-pressure release from a liquid carbon dioxide tank. ,Fatality
9/22/2013,"Brighton Window Cleaning, St. Cloud, MN 56301",Worker died after falling six stories while washing windows.,Fatality
9/22/2013,"Energy Drilling Company, Oberlin, LA 70655",Worker struck and killed by a joint casing that fell from a truck.,Fatality
9/21/2013,"City of Laguna Beach, Laguna Beach, CA 92607",Worker in vehicle was struck by truck on public highway.,Fatality
9/21/2013,"Filiberto Serna, New Orleans, LA 70143",Worker was crushed while disassembling a modular trailer unit.,Fatality
9/20/2013,"Campanella Corporation, Vallejo, CA 94592",Worker struck and killed by a construction tractor scraper.,Fatality
9/20/2013,"IMPD, Indianapolis, IN 46204",Officer shot and killed while attempting to rescue a victim of domestic violence.,Fatality
9/20/2013,"KDW Construction LLC, Mare Island, CA 94592",Worker was struck and killed by a construction tractor scraper while surveying a worksite. ,Fatality
9/20/2013,"Overgard Inc., Eleva, WI 54738",Worker killed in a vehicle collision after the trailer of the vehicle  became unhitched.,Fatality
9/20/2013,"Smiley Plaster Co., Swainsboro, GA 30401",Worker performing stucco work from a second level scaffold died after falling 16 feet.,Fatality
9/19/2013,"Gold N? Stuff, Ventura, CA 93003",Worker died after falling 45-feet from a tree during trimming operations.,Fatality
9/19/2013,"Lamar Advertising, Gary, IN 46408",One worker electrocuted and two others hospitalized while working on an outdoor billboard.,Fatality
9/19/2013,"R & J Construction Inc., Fort Payne, AL 35967",Worker installing metal roof clips died after falling 28 feet.,Fatality
9/19/2013,"Yager Materials LLC, Owensboro, KY 42302",Worker replacing dump truck axle was crushed when the floor jack failed.,Fatality
9/18/2013,"Kenny Construction Company, Chicago, IL 60618",Worker drowned while relining the inside of a sewer during a heavy rain.,Fatality
9/17/2013,"Avis Car Rental, Grand Junction, CO 81506",Worker driving a rental car shuttle was killed in a vehicle collision.,Fatality
9/17/2013,"Joel Cornelius Enterprises Inc., Harrison, OH 45030",Worker died from fall while conducting repairs to a gutter on a residential house.  ,Fatality
9/17/2013,"Vanderbilt Landscaping LLC, Brownsville, TN 38012",Worker struck and killed by a vehicle while picking up roadside debris.,Fatality
9/16/2013,"C&D Ventures (DBA Gold Coast Dairy), Goleta, CA 93117)",Worker was crushed between truck and loading dock while unloading material.,Fatality
9/16/2013,"Castlewood Consulting LLC, Glen Echo, MD 21812",Worker operating back hoe died after being caught-between the machine and house under construction.,Fatality
9/16/2013,"Distribution Export Logistics Inc., Houston, TX 77043",Worker performing maintenance on an electrical forklift was crushed and killed by the machine's overhead guard and mast. ,Fatality
9/16/2013,"Johnny's Electric, Inc., Fernandina Beach, FL 32034",Electrician working from an aerial lift was electrocuted by an overhead power line.,Fatality
9/16/2013,"SRic-Man Construction Florida, Inc., Miami, FL 33173",Worker struck and killed by a valve assembly.,Fatality
9/15/2013,"Rogers Helicopters Inc., Perryville, AR 72126",Worker electrocuted while servicing transmission lines from a helicopter.,Fatality
9/14/2013,"Caliber Cast Stone, O' FALLON  MO 63366",Worker died after being struck by the cement mixer he was repairing.,Fatality
9/14/2013,"Ravenswood Disposal Service Inc., Chicago, IL 60612",Worker was crushed between a box truck and a front end loader.,Fatality
9/13/2013,"Beyel Bros. Inc., Merritt Island, FL 32952",A deck hand drowned after falling into the water while assisting in securing a tug boat to a barge.,Fatality
9/13/2013,"Contractors Inc., Orange, CA 92879 (vacant building)",Worker electrocuted while working on an electrical panel inside vacant commercial building.,Fatality
9/13/2013,"Formosa Plastics Corporation Texas, Point Comfort, TX 77978",Five workers were hospitalized for injuries sustained in a flash fire caused by the release of a chemical under pressure.,Catastrophe
9/13/2013,"Nuco 2 Inc., Miami, FL 33126",Worker died after being struck by an SUV.,Fatality
9/12/2013,"Cronin Construction, Oviedo, FL 32765",Worker died after being struck by a vehicle while working on a roadway project.,Fatality
9/12/2013,"GA Paving LLC, Chicago, IL 60621",Worker died after being pulled into the grinding section of an asphalt paving machine.,Fatality
9/12/2013,"Patty?s Forestry Services Inc., Mammoth Lakes, CA 93546",Worker died after being struck by a falling branch while trimming a tree.,Fatality
9/11/2013,"7Joy Process Mechanical Inc., Canastota, NY 13032",Worker welding inside a tank connected to a sewage treatment facility died in an explosion..,Fatality
9/11/2013,"Bethel Frame & Wheel Alignment Service LLC, Bethel, OH 45106",Worker performing brake repairs died after falling from a step ladder.,Fatality
9/11/2013,"Color Dynamics Inc., Honolulu, HI 96822",Worker died after falling 50 feet from a suspension scaffold.,Fatality
9/11/2013,"Hartin Paint & Filler Corp., Carlstadt, NJ 07072",Worker died after being overcome by toluene vapor while taking solvent level measurements from an outdoor storage tank. ,Fatality
9/11/2013,"Lyford Gin Association, San Benito, TX 78586",Worker performing trash removal died after falling from tractor and being run over.,Fatality
9/11/2013,"S K Lumber, Cochranton, PA 16314",Forklift operator was killed when the lift went off a dock and rolled onto him.,Fatality
9/11/2013,"TJ Lyle & Company, Rome, GA 30161","Worker cutting a water pipe with a chain saw died after the saw kicked back and cut his neck, severing arteries. ",Fatality
9/11/2013,"US Foods, Selem, MO 65560",Worker died after falling from the bumper of a cooler truck.  ,Fatality
9/11/2013,"Westcoast Tree Care Inc., Lake Oswego, OR 97035",Worker died from overexposure to heat while trimming trees.,Fatality
9/10/2013,"Heber Farms, Belleville, IL 62220",Worker died after falling off of a six foot ladder. ,Fatality
9/10/2013,"Rachel Contracting Inc., St. Paul, MN",Worker was crushed by large piece of concrete that fell onto cab of the crane.  ,Fatality
9/10/2013,"Sierra Steel Buildings Inc., Northville, SD 57465",Worker installing insulation and panels on the roof of a steel building died after falling approximately 20 feet. ,Fatality
9/10/2013,"Terminix Pest Control, Wheeling, WV 26003",Worker died after being stung several times during a service call. ,Fatality
9/9/2013,"Bdaric Excavating, Swoyerville, PA 18704",Worker died after the steeple of a church that was being demolished fell on the cab of the tractor he was operating.,Fatality
9/9/2013,"GFW Welding & Co., Derby, CT 06418",Worker crushed by a snow plow blade that slid off forklift blades.,Fatality
9/9/2013,"Godwin Formwork Solutions, Norman, OK 73019",Worker died from a 67-foot fall when the scaffold he stepped onto collapsed. ,Fatality
9/9/2013,"Madden Galvanizing LLC, Houston, TX 77040",Worker was crushed by the forklift he was operating when it fell over on him. ,Fatality
9/9/2013,"Wal Mart Assoc. Inc., Clinton, UT 84015",Worker stocking merchandise died in fall from step ladder.,Fatality
9/9/2013,"Werner Construction Inc., Albion, NE 68620",Worker died after being struck by a motor bucket.,Fatality
9/8/2013,"Universal Constructors Inc., Piscataway, NJ 08854",Worker died after being run over and crushed by bulldozer.,Fatality
9/8/2013,"Watts Brothers Cable Construction, Calhoun, KY 42327",Worker was struck and killed by tree that was being removed from a telephone line. ,Fatality
9/7/2013,"Jenny's Kauli, Bethlehem, PA 18015",Three workers were hospitalized after the butane canisters over-heated and exploded. ,Catastrophe
9/7/2013,"Premier Bulk Stevedoring LLC, Mobile, AL 36602",Shipboard rigger died after being struck by falling cargo while it was being transferred from the pier.,Fatality
9/7/2013,"Sunwest Fruit Company Inc.,Traver, CA 93673",Worker killed in collision between all-terrain vehicle he was operating and another vehicle.,Fatality
9/6/2013,"Celco Construction Company, Desert Hot Springs, CA 92240",Worker electrocuted while changing power pack. ,Fatality
9/6/2013,"Powder Coat II, Mt Clemens, MI 48043",Worker crushed between transfer cart and automotive paint coating machine.,Fatality
9/6/2013,"Scrap Metal Recycling Inc., Vegas Baja, PR 00693",Worker operating a compact excavator was caught between bucket and machine frame.,Fatality
9/6/2013,"Stalcup Roofing & Construction LLC, Sandy Creek, OR 97055",One worker killed and three others hospitalized when roof trusses that were being installed fell over and collapsed into structure under construction.  ,Fatality
9/6/2013,"Williams Brothers Construction Co. Inc., Willis, TX 77378",Worker performing paving/concrete work died after being struck by a driveshaft.,Fatality
9/5/2013,"Coastal Leak Consulting Inc., Houston, TX 77066",Plumber was electrocuted while cutting through a pipe.,Fatality
9/5/2013,"Dan Hoe Excavating, Grand Haven, MI 49242",Worker leveling stone in preparation for paving was struck and killed by a skid steer operating in reverse.,Fatality
9/5/2013,"Saleh?s Market, Elkhart, IN  46516 ",Two workers were shot and killed during store robbery.,Fatality
9/4/2013,"Cromwell Dozer & Backhoe L.P., Bristow, OK 74010",Worker died in an explosion at an oil tank battery.,Fatality
9/4/2013,"Greentech Energy Services, Skippack, PA 19474",Electrical journeyman electrocuted while installing lighting equipment.  ,Fatality
9/4/2013,"Roy Webster Orchards Inc., Hood River, OR 97031",Worker crushed and killed when the tractor he was operating rolled down a steep ravine.  ,Fatality
9/4/2013,"Union Pacific Railroad, Mathis, TX 78368",Worker in an aerial lift repairing a railroad trestle died after falling 40-60 feet.,Fatality
9/3/2013,"Baker Grading & Landscaping Inc., Marion, NC 28752",Worker sweeping debris from roadway died when a dump truck backed over him.,Fatality
9/3/2013,"Juon Painting (Subcontractor); Calwide Painting (General Contractor), Thousand Oaks, CA 91362",Worker painting died after falling 15 feet from ladder. ,Fatality
9/3/2013,"Orange County Amish Saw Mill, Orleans, IN 47452",Worker killed by moving saw blade.,Fatality
9/3/2013,"Ponder Well Service Inc., Neil, AR 71752",Worker at a well site collapsed and died from heat.,Fatality
9/3/2013,"Westfire Coastal Inc., Woodinville, WA 98072",Worker was killed in vehicle collision.,Fatality
9/2/2013,"Blanchi Partnership, Nelson, CA 95958",Worker died in all terrain vehicle crash.,Fatality
9/2/2013,"Mid-South Agricultural Equipment Inc., Sumner, MS 38957",Worker performing tractor maintnenace was killed when the vehicle slipped into gear and rolled over him.,Fatality
9/1/2013,"L & M Painting LLC, Irondale, AL 35210",Worker died after falling 50 feet while pressure washing the inside of a water tower.,Fatality
9/1/2013,"Labor Ready, Burlington, MA 01803",Worker died after falling from a fixed ladder while replacing filters in a HVAC system located on the roof.,Fatality
8/31/2013,"L & M Painting LLC, Irondale, AL 35210",Worker died after falling 50 from a ladder inside a water tower.,Fatality
8/31/2013,"Russo Brothers Construction LLC, Johnston, RI 02919",Employee killed after being run over by a dump truck while making repairs to the braking system.,Fatality
8/31/2013,"Simmons Foods Inc., Siloam Springs, AR 72761",Four workers hospitalized after being overexposed to carbon dioxide at a poultry processing plant.,Catastrophe
8/31/2013,"Wally's Tree Service, Wapakoneta, OH 45895",Worker killed after falling from an extension ladder during tree trimming operations.,Fatality
8/31/2013,"YMCA New York, White Plains, NY 10605",Security guard was stabbed to death by a resident.,Fatality
8/30/2013,"Asplundh Tree Expert Co., Blairsville, PA 15717",Three employees were hospitalized when their utility vehicle rolled over. ,Catastrophe
8/30/2013,"Atlantic City Electric, Turnersville, NJ 08012",Worker struck and killed by a utility pole that had fallen off the back of a boom truck. ,Fatality
8/30/2013,"Santa Fe National Forest, Jemez Springs, NM 87025",Employee killed in an ATV acident while investigating a report of smoke in the Santa Fe National Forest. ,Fatality
8/30/2013,"SMC Networks Inc., Buford, GA 30519",Worker delivering a package struck and killed by another vehicle.,Fatality
8/29/2013,"Auger Services Inc., Columbus, TX 78934",Driver loading a drilling rig onto a truck died after being struck by a cable.,Fatality
8/29/2013,"Double H Construction of Lake Okeechobee Inc., Punta Gorda, FL 33950",Construction worker died in a motor vehicle accident. ,Fatality
8/29/2013,"Grove U.S. LLC, Shady Grove, PA 17256",Worker died after being pinned between two mobile cranes.,Fatality
8/29/2013,"Sheehan Pipeline Construction, Steubenville, OH 43952",Worker died after falling from construction equipment.,Fatality
8/29/2013,"Track Utilities LLC, Medicine, Lodge, KS 67104",Worker electrocuted while reconstructing a power line. ,Fatality
8/29/2013,"United Forming, Houston, TX 77027",Worker died after falling 11 floors down an elevator shaft.,Fatality
8/29/2013,"William J. Morse Jr. LLC, Stephentown, NY 12168",Worker struck and killed by a falling tree during tree-cutting operations.,Fatality
8/28/2013,"A. Finkl & Sons Co., Chicago, IL 60619",Employee killed after being struck by material hanging from an overhead crane.,Fatality
8/28/2013,"Charter, Keshena, WI 54135",Worker suffered multiple bee stings and died after falling abd striking his head. ,Fatality
8/28/2013,"El Rodeo Restaurant LLC, Riverdale, MD 20737",Worker installing a banner died after falling from an extension ladder. ,Fatality
8/28/2013,"U.S. Department of Interior, Cherokee, NC 28719",Worker died after a riding lawn mower rolled onto him.,Fatality
8/28/2013,"Wightman Oil Company, Andover, NY 14806",Oil worker servicing a well died after being struck by falling equipment when the oil rig mast broke.,Fatality
8/27/2013,"McCoy's Building Supply, Lufkin, TX 75901",Employee loading sheetrock was killed after being pinned between a loaded forklift and a flatbed truck. ,Fatality
8/27/2013,"Sodexo Management Company, Garden City, KS 67846",Employee struck and killed by a car.,Fatality
8/26/2013,"Allen Development Group Inc., Columbus, GA 31909",Two workers were killed at an excavation site when the 15-foot deep trench they were working in collapsed. ,Fatality
8/26/2013,"Bluewater Yacht Sales LLC, Hampton, VA 23669",Employee drowned after falling from a floating dock while washing the hull of motor yacht.,Fatality
8/26/2013,"CB Construction Corp., Sarasota, FL 34242",Employee drowned while inspecting a seawall under construction.,Fatality
8/26/2013,"JBA Land Management, Plano TX 75025",Worker drowned in a golf course pond when a lawnmower flipped over onto him.,Fatality
8/26/2013,"Leal Trucking, Alliance, NE 69301",Worker crushed and killed by a truck while removing a pnuematic powered axle.,Fatality
8/26/2013,"MFA Inc., Aurora, MO 65605",Worker died after falling nearly 30 feet from a manlift.,Fatality
8/26/2013,"Panchos Fencing, Guthrie, TX 79236",Employee killed after being struck by a backhoe.,Fatality
8/24/2013,"CC Zamora Construction LLC, Fort Worth, TX 76129",Worker died when a chimney fell on him during demolition operations.,Fatality
8/24/2013,"Not Trucking LLC, Killdeer, ND 58640",Worker was killed after being run over by a truck and tanker trailer at a fracking oil well site.,Fatality
8/24/2013,"Rutledge Floor Covering, Torrance, CA 90505",Worker died from fall while installing floor covering.,Fatality
8/23/2013,"Centerpoint Energy, Katy, TX 77494",Worker killed when caught between the ground and bumper of the bucket truck he was repairing.  ,Fatality
8/23/2013,"Clarion Boards Inc., Shippenville, PA 16254",Worker fatally crushed between a roller conveyor and the conveyor system while working on a hydraulic pump.,Fatality
8/23/2013,"Deviney Construction Company, MS 39212",Worker electrocuted by power line.     ,Fatality
8/23/2013,"Erie Insurance Group, Hobart, WI 54115",Insurance employee was killed in a motor vehicle crash while traveling on business.,Fatality
8/23/2013,"Globe Energy Services, Henderson, TX 75652",Worker died in fall down staircase.,Fatality
8/22/2013,"Heartland Footwear Inc., Pocahontas, AR 72455",Worker killed when caught in a rotary injection molding machine.,Fatality
8/22/2013,"Ryman Lynn May, Simsboro, LA 71275",Truck driver was fatally crushed under the landing gear of a semi-trailer.,Fatality
8/22/2013,"Troy Construction LLC, Jackson, TX 77566",Employee working as a highway workzone flagger was struck and killed by motor vehicle.,Fatality
8/21/2013,"Koch Construction Company Inc., Kingsville, TX 78363",Construction worker died from heat stress.,Fatality
8/21/2013,"T-5 Construction Inc., Garrison, TX 75946",Worker electrocuted from overhead power line.,Fatality
8/20/2013,"Ahronian Landscaping & Design Inc., Holliston, MA 01746",Worker in aerial lift burned and electrocuted from overhead electrical line.,Fatality
8/20/2013,"Classic Irrigation & Landscape Inc., Missouri City, TX 77459",Landscape employee crushed and killed by tractor and truck.,Fatality
8/20/2013,"Nova Geotechnical and Inspection Services PLLC,                                        Las Vegas, NV  89118",Worker died after falling 20 feet through aluminum decking from second level of steel structure.,Fatality
8/20/2013,"Re Planet, Cucamonga, CA 91730",Worker was struck and killed by skid loader.,Fatality
8/19/2013,"Four Brothers Goat Farm, Millerton, NY 12546",Farm worker was killed after being run over by tractor.,Fatality
8/19/2013,"Lake Painting Inc., Midland, MI 48640",One worker was killed and two hospitalized in a fall from self-propelling work platform.,Fatality
8/19/2013,"Medallion Security Door & Window Company,                               Severn, MD 21144",Worker died when a 7-foot deep trench collapsed.,Fatality
8/19/2013,"Moark LLC, Turner, ME 04282",Worker shot and killed in a chicken barn. ,Fatality
8/19/2013,"Rick's Auto Body, Missoula, MT 59808",Employee died from burns from a vapor fire in a paint room.,Fatality
8/19/2013,"Southern Agri Systems Inc., Indianola, MS 38751",Forklift operator killed after being struck by a distracted driver.,Fatality
8/19/2013,"Terminix Service Inc., Lake City, SC  29560",Worker electrocuted while performing extermination work.,Fatality
8/19/2013,"Tutoring Club, Fountain Valley, CA 92708",Driver killed in vehicle accident.,Catastrophe
8/17/2013,"50 State Security Inc., Homestead, FL 33032",Secutiry worker fatally while patrolling.,Fatality
8/17/2013,"Custom Tower LLC, Louise, MS 39097",Worker installing satellite dishes to a communications tower died after falling 125 feet.,Fatality
8/17/2013,"Golden Touch Painting, North Salem, NY 10560",Painter died after falling from a 30-foot ladder. ,Fatality
8/17/2013,"Island Field Services LLC, Galveston, TX 77554",Worker died from chemical pneumonitis after being exposed to sulfuric acid and sulfur dioxide.,Fatality
8/17/2013,"North American Roofing LLC, Ashtabula, OH 44004",Worker installing sheet metal roof materials died after falling 20 feet through a skylight.,Fatality
8/16/2013,"Universal Pegasus Power Services Inc., ENCINO  TX 78353",Worker died from heat stroke during surveying operations.,Fatality
8/16/2013,"US Forest Service, Albuquerque, NM 87109",Worker died from a spider bite.,Fatality
8/15/2013,"FMS Drilling, Lafayette, OH 43845",Oil rig worker died after falling 60 feet.,Fatality
8/15/2013,"Wire Mesh Corp., Jacksonville, FL 32226",Worker was fatally crushed between feeding cart and feeding tray roller assembly.,Fatality
8/14/2013,"Aldridge Electric Inc., New Prague, MN 56071",Electrical worker died after falling into 50 foot hole.,Fatality
8/14/2013,"Brothers With Brushes, Warrenton, MO 63383",Worker electrocuted by high tension wires.,Fatality
8/14/2013,"F&T  Farms, Caruthers, CA  93609",Worker crushed and killed after being caught between dump truck and parked trailer.,Fatality
